{
  "size": 102429060,
  "features": 124672,
  "name": "Buildings",
  "description":"Building data from Harford County, MD",
  "version":"1.0.0",
  "published": "2018-09-13T15:05:16+00:00",
  "extended_metadata": 
    { 
        "start": 52462,
        "size": 14575 
    },
  "bbox": [
    -76.57139851406845,
    39.39485141810742,
    -76.08362813450836,
    39.72564001999409
  ],  
  "tiles": [
    {
      "start": 10240,
      "size": 327634,
      "bbox": [
        -76.14459943195337,
        39.47754856857909,
        -76.08362813450836,
        39.518897143814925
      ],
      "features": 329
    },
    {
      "start": 337875,
      "size": 5200289,
      "bbox": [
        -76.14459943195337,
        39.518897143814925,
        -76.08362813450836,
        39.560245719050755
      ],
      "features": 5826
    }
  ]
}